----------------------------------------------------------------------------
CrystalDiskInfo 8.17.13 (C) 2008-2022 hiyohiyo
                                Crystal Dew World: https://crystalmark.info/
----------------------------------------------------------------------------

    OS : Windows 10 Professional [10.0 Build 19045] (x64)
  Date : 2023/01/02 13:40:09

-- Controller Map ----------------------------------------------------------
 + Standard SATA AHCI Controller [ATA]
   - WD Blue SA510 2.5 1TB
   - hp CDDVDW SH-216ALN
 - Microsoft Storage Spaces Controller [SCSI]

-- Disk List ---------------------------------------------------------------
 (01) WD Blue SA510 2.5 1TB : 1000.2 GB [0/0/0, pd1] - wd

----------------------------------------------------------------------------
 (01) WD Blue SA510 2.5 1TB
----------------------------------------------------------------------------
           Model : WD Blue SA510 2.5 1TB
        Firmware : 52008100
   Serial Number : 223407A015C1
       Disk Size : 1000.2 GB (8.4/137.4/1000.2/1000.2)
     Buffer Size : Unknown
     Queue Depth : 32
    # of Sectors : 1953525168
   Rotation Rate : ---- (SSD)
       Interface : Serial ATA
   Major Version : ACS-4
   Minor Version : ACS-2 Revision 3
   Transfer Mode : SATA/600 | SATA/600
  Power On Hours : 14 hours
  Power On Count : 41 count
      Host Reads : 1221 GB
     Host Writes : 1399 GB
     NAND Writes : 29 GB
     Temperature : 27 C (80 F)
   Health Status : Good (100 %)
        Features : S.M.A.R.T., APM, NCQ, TRIM, DevSleep, GPL
       APM Level : 0000h [OFF]
       AAM Level : ----
    Drive Letter : C:

-- S.M.A.R.T. --------------------------------------------------------------
ID Cur Wor Thr RawValues(6) Attribute Name
05 100 100 _10 000000000000 Reassigned Block Count
09 100 100 __0 00000000000E Power On Hours
0C 100 100 __0 000000000029 Power Cycle Count
A5 100 100 __0 0043005A0059 Block Erase Count (SLC)
A6 100 100 __0 000000000001 Minimum P/E Cycles
A7 100 100 __0 00000000001B Maximum Bad Blocks per die
A8 100 100 __0 000000000002 Maximum P/E Cycles
A9 100 100 __0 0000000000DF Total Bad Block
AA 100 100 __0 000000000000 Grown Bad Blocks
AB 100 100 __0 000000000000 Program Fail Count
AC 100 100 __0 000000000000 Erase Fail Count
AD 100 100 __5 000000000001 Average P/E Cycles
AE 100 100 __0 000000000002 Unexpected Power Loss Count
B8 100 100 _97 000000000000 End-to-End Error Detection/Correction Count
BB 100 100 __0 000000000000 Reported Uncorrectable Errors
BC 100 100 __0 000000000000 Command Timeout Count
C2 100 100 _14 00250011001B Temperature
C7 100 100 __0 000000000000 CRC Error Count
E6 100 100 __0 001600140016 Media Wearout Indicator
E8 100 100 __4 000000000057 Available Reserve Space
E9 100 100 __0 00000000001D NAND GB Written
EA 100 100 __0 000000000BE5 NAND GB Written (SLC)
F1 253 253 __0 000000000577 Total GB Written
F2 253 253 __0 0000000004C5 Total GB Read
F4 100 100 __0 000000000000 Temperature Throttle Status

-- IDENTIFY_DEVICE ---------------------------------------------------------
        0    1    2    3    4    5    6    7    8    9
000: 0040 3FFF C837 0010 0000 0000 003F 0000 0000 0000
010: 3232 3334 3037 4130 3135 4331 2020 2020 2020 2020
020: 0000 0000 0000 3532 3030 3831 3030 5744 2042 6C75
030: 6520 5341 3531 3020 322E 3520 3154 4220 2020 2020
040: 2020 2020 2020 2020 2020 2020 2020 8001 4000 2F00
050: 4000 0000 0000 0006 3FFF 0010 003F FC10 00FB 9D01
060: FFFF 0FFF 0000 0007 0003 0078 0078 0078 0078 4F00
070: 0000 0000 0000 0000 0000 001F 850E 0006 054C 0040
080: 0FF0 0110 306B 7509 4123 3469 B401 4123 207F 800A
090: 0000 0000 FFFE 0000 0000 0000 0000 0000 0000 0000
100: 6DB0 7470 0000 0000 0000 0008 4000 0000 5001 B448
110: BD6D 1F52 0000 0000 0000 0000 0000 0000 0000 411C
120: 401C 0000 0000 0000 0000 0000 0000 0000 0009 0000
130: 0000 0000 0000 0000 0000 0000 0000 0000 0000 0000
140: 0000 0000 0000 0000 0000 0000 0000 0000 0000 0000
150: 0000 0000 0000 0000 0000 0000 0000 0000 0000 0000
160: 0000 0000 0000 0000 0000 0000 0000 0000 0003 0001
170: 2020 2020 2020 2020 0000 0000 0000 0000 0000 0000
180: 0000 0000 0000 0000 0000 0000 0000 0000 0000 0000
190: 0000 0000 0000 0000 0000 0000 0000 0000 0000 0000
200: 0000 0000 0000 0000 0000 0000 0000 0000 0000 4000
210: 0000 0000 0000 0000 0000 0000 0000 0001 0000 0000
220: 0000 0000 10FF 0000 0000 0000 0000 0000 0000 0000
230: 0000 0000 0000 0000 0008 0008 0000 0000 0000 0000
240: 0000 0000 0000 0000 0000 0000 0000 0000 0000 0000
250: 0000 0000 0000 0000 0000 43A5

-- SMART_READ_DATA ---------------------------------------------------------
     +0 +1 +2 +3 +4 +5 +6 +7 +8 +9 +A +B +C +D +E +F
000: 00 00 05 32 00 64 64 00 00 00 00 00 00 00 09 32
010: 00 64 64 0E 00 00 00 00 00 00 0C 32 00 64 64 29
020: 00 00 00 00 00 00 A5 32 00 64 64 59 00 5A 00 43
030: 00 00 A6 32 00 64 64 01 00 00 00 00 00 00 A7 32
040: 00 64 64 1B 00 00 00 00 00 00 A8 32 00 64 64 02
050: 00 00 00 00 00 00 A9 32 00 64 64 DF 00 00 00 00
060: 00 00 AA 32 00 64 64 00 00 00 00 00 00 00 AB 32
070: 00 64 64 00 00 00 00 00 00 00 AC 32 00 64 64 00
080: 00 00 00 00 00 00 AD 32 00 64 64 01 00 00 00 00
090: 00 00 AE 32 00 64 64 02 00 00 00 00 00 00 B8 32
0A0: 00 64 64 00 00 00 00 00 00 00 BB 32 00 64 64 00
0B0: 00 00 00 00 00 00 BC 32 00 64 64 00 00 00 00 00
0C0: 00 00 C2 22 00 64 64 1B 00 11 00 25 00 00 C7 32
0D0: 00 64 64 00 00 00 00 00 00 00 E6 32 00 64 64 16
0E0: 00 14 00 16 00 00 E8 33 00 64 64 57 00 00 00 00
0F0: 00 04 E9 32 00 64 64 1D 00 00 00 00 00 00 EA 32
100: 00 64 64 E5 0B 00 00 00 00 00 F1 30 00 FD FD 77
110: 05 00 00 00 00 00 F2 30 00 FD FD C5 04 00 00 00
120: 00 00 F4 32 00 64 64 00 00 00 00 00 00 00 00 00
130: 00 00 00 00 00 00 00 00 00 00 00 00 00 00 00 00
140: 00 00 00 00 00 00 00 00 00 00 00 00 00 00 00 00
150: 00 00 00 00 00 00 00 00 00 00 00 00 00 00 00 00
160: 00 00 00 00 00 00 00 00 00 00 00 00 00 00 00 71
170: 03 00 01 00 01 0A 01 00 00 00 00 00 00 00 00 00
180: 00 00 00 00 00 00 00 00 00 00 00 00 00 00 00 00
190: 00 00 00 00 00 00 00 00 00 00 00 00 00 00 00 00
1A0: 00 00 00 00 00 00 00 00 00 00 00 00 00 00 00 00
1B0: 00 00 00 00 00 00 00 00 00 00 00 00 00 00 00 00
1C0: 00 00 00 00 00 00 00 00 00 00 00 00 00 00 00 00
1D0: 00 00 00 00 00 00 00 00 00 00 00 00 00 00 00 00
1E0: 00 00 00 00 00 00 00 00 00 00 00 00 00 00 00 00
1F0: 00 00 00 00 00 00 00 00 00 00 00 00 00 00 00 70

-- SMART_READ_THRESHOLD ----------------------------------------------------
     +0 +1 +2 +3 +4 +5 +6 +7 +8 +9 +A +B +C +D +E +F
000: 01 00 05 0A 00 00 00 00 00 00 00 00 00 00 09 00
010: 00 00 00 00 00 00 00 00 00 00 0C 00 00 00 00 00
020: 00 00 00 00 00 00 A5 00 00 00 00 00 00 00 00 00
030: 00 00 A6 00 00 00 00 00 00 00 00 00 00 00 A7 00
040: 00 00 00 00 00 00 00 00 00 00 A8 00 00 00 00 00
050: 00 00 00 00 00 00 A9 00 00 00 00 00 00 00 00 00
060: 00 00 AA 00 00 00 00 00 00 00 00 00 00 00 AB 00
070: 00 00 00 00 00 00 00 00 00 00 AC 00 00 00 00 00
080: 00 00 00 00 00 00 AD 05 00 00 00 00 00 00 00 00
090: 00 00 AE 00 00 00 00 00 00 00 00 00 00 00 B8 61
0A0: 00 00 00 00 00 00 00 00 00 00 BB 00 00 00 00 00
0B0: 00 00 00 00 00 00 BC 00 00 00 00 00 00 00 00 00
0C0: 00 00 C2 0E 00 00 00 00 00 00 00 00 00 00 C7 00
0D0: 00 00 00 00 00 00 00 00 00 00 E6 00 00 00 00 00
0E0: 00 00 00 00 00 00 E8 04 00 00 00 00 00 00 00 00
0F0: 00 00 E9 00 00 00 00 00 00 00 00 00 00 00 EA 00
100: 00 00 00 00 00 00 00 00 00 00 F1 00 00 00 00 00
110: 00 00 00 00 00 00 F2 00 00 00 00 00 00 00 00 00
120: 00 00 F4 00 00 00 00 00 00 00 00 00 00 00 00 00
130: 00 00 00 00 00 00 00 00 00 00 00 00 00 00 00 00
140: 00 00 00 00 00 00 00 00 00 00 00 00 00 00 00 00
150: 00 00 00 00 00 00 00 00 00 00 00 00 00 00 00 00
160: 00 00 00 00 00 00 00 00 00 00 00 00 00 00 00 00
170: 00 00 00 00 00 00 00 00 00 00 00 00 00 00 00 00
180: 00 00 00 00 00 00 00 00 00 00 00 00 00 00 00 00
190: 00 00 00 00 00 00 00 00 00 00 00 00 00 00 00 00
1A0: 00 00 00 00 00 00 00 00 00 00 00 00 00 00 00 00
1B0: 00 00 00 00 00 00 00 00 00 00 00 00 00 00 00 00
1C0: 00 00 00 00 00 00 00 00 00 00 00 00 00 00 00 00
1D0: 00 00 00 00 00 00 00 00 00 00 00 00 00 00 00 00
1E0: 00 00 00 00 00 00 00 00 00 00 00 00 00 00 00 00
1F0: 00 00 00 00 00 00 00 00 00 00 00 00 00 00 00 94

